DATE|TITLE|DESCRIPTION|CHANGE|LEVEL
2021-04-08 19:12:00|Levi Strauss raises sales outlook on vaccine hopes, shares jump|Levi Strauss & Co on Thursday raised its half-year revenue growth forecast, banking on COVID-19 vaccine rollouts to spur a return to normalcy, after the denim maker beat estimates for quarterly results on a pandemic-led e-commerce boost.|3.7796515425236876e-05|0.0
2021-04-08 17:29:00|Explainer: Amazon's fight against U.S. union could continue even after landmark vote|Officials with the National Labor Relations Board (NLRB) are expected to begin counting ballots on Thursday in the closely watched union election at an Amazon.com Inc warehouse in Bessemer, Alabama.|-0.00031468707516502104|-1.0
2021-04-07 19:10:00|U.S. SEC blocks Amazon effort to stop shareholder votes on racial equity audit|U.S. securities regulators on Wednesday turned down an exemption sought by Amazon.com Inc to stop its investors from considering a shareholder proposal related to racial equity at the e-commerce giant.|-0.001848044125402848|-4.0
2021-04-06 19:21:00|Amazon supports higher corporate taxes in U.S.: Bezos|Amazon.com Inc is in support of a rise in U.S. corporate tax rates, the e-commerce firm's outgoing chief executive officer Jeff Bezos said on Tuesday.|0.00044223467499993063|1.0
2021-04-06 13:47:00|EU backs U.S. call for global minimum corporate tax, but rate to be decided|The European Commission backed on Tuesday a call from U.S. Treasury Secretary Janet Yellen for a global minimum corporate tax, but said its rate should be decided in talks in the Organisation for Economic Cooperation and Development (OECD).|0.00039273563240560527|1.0
2021-04-05 16:39:00|Japan Feb household spending seen down for third straight month: Reuters poll|Japanese household spending likely dropped in February from a year earlier, falling for a third straight month, a Reuters poll found on Friday, suggesting emergency steps to contain the coronavirus infection kept a lid on consumer expenditure.|-0.00045835638533542333|-1.0
2021-03-31 18:23:00|Microsoft wins $21.9 billion contract with U.S. Army to supply augmented reality headsets|Microsoft Corp on Wednesday said it has won a deal to sell the U.S. Army augmented reality headsets based on its HoloLens product and backed by Azure cloud computing services.|0.00044915144318879996|1.0
2021-03-30 16:16:00|CD Projekt says every patch brings Cyberpunk closer to PlayStation Store|Poland's video games maker CD Projekt said every patch to its flagship game Cyberpunk 2077 brings the product closer back to Sony's PlayStation, the company's board member said on Tuesday.|-0.0011505058939070834|-3.0
2021-03-26 18:37:00|U.S. accuses China of 'state-led' social media campaign against companies over Xinjiang|"The United States on Friday condemned what it called a ""state-led"" social media campaign in China against U.S. and other international companies for deciding not to use cotton from China's Xinjiang region over forced labor concerns."|-0.0001993408462579449|-1.0
2021-03-26 17:16:00|White House watching China closely on forced labor after U.S. firms pressured|The White House on Friday criticized China for profiting from human rights abuses and said it was watching the issue of forced labor closely after U.S. and other international companies came under attack from Chinese consumers for committing not to use cotton from China's...|-0.0014614974166440309|-4.0
2021-03-26 14:26:00|Airbnb supply gets a boost as vacationers prefer remote stays - AirDNA|U.S. home rental company Airbnb Inc's supply more than doubled over the past four years, while surpassing some of the traditional hotel chains combined, data from analytics firm AirDNA showed on Friday.|0.00170693277310896|4.0
2021-03-24 14:41:00|Sports retailer Fanatics raises $320 million at $12.8 billion valuation in new funding round|Fanatics, the world's biggest licensed sports merchandise retailer, raised $320 million in fresh capital in a funding round that valued the company at $12.8 billion, according to sources close to the deal.|0.0005410409099821933|1.0
2021-03-24 14:06:00|Private equity firm Advent has profit over 300% on Brazil deal|Private equity firm Advent International had a profit of around 300% in its investment in Brazilian supermarket chain BIG after agreeing to sell it to Carrefour Brasil for 7.5 billion reais ($1.4 billion), in local currency terms.|0.00023462237670779373|1.0
2021-03-23 13:52:00|UK's Sunak says international tax reform is within grasp|British finance minister Rishi Sunak said on Tuesday that he thought reform of the international tax system to reflect the digital world was possible through the co-operation of major world economies.|-0.002069991590658904|-4.0
2021-03-22 14:01:00|UK shopper numbers edge higher as end of restrictions nears|The number of people heading out to shops across Britain rose by 0.5% in the week to March 20 from a week earlier, the eighth rise in nine weeks despite a national lockdown, market researcher Springboard said on Monday.|-0.002025444137429333|-4.0
2021-03-19 18:10:00|Mexican judge halts electricity law, as president says top court should rule|A Mexican court ordered a definitive suspension of the government's contentious new electricity law in a ruling published Friday, just as President Andres Manuel Lopez Obrador called for the Supreme Court to settle the matter.|-3.257944497525589e-05|0.0
2021-03-19 16:16:00|India antitrust body says Reuters story corroborates evidence in probe of Amazon|India's antitrust body on Friday told a court that a Reuters report showing Amazon.com Inc gave preferential treatment to a small group of sellers on its India platform corroborated evidence it had received and which had triggered an investigation of the U.S. e-commerce...|0.0009477805594351185|2.0
2021-03-18 16:12:00|Indian court restrains Future chief from selling assets in dispute with Amazon|An Indian court on Thursday restrained Future Group chief Kishore Biyani from selling his personal assets following Amazon.com Inc's challenge against the Indian group's $3.4 billion sale of its retail business.|0.000816823904624675|2.0
2021-03-16 19:50:00|Exchange leaders say GameStop saga highlights regulatory challenges|"The recent trading frenzy around GameStop Corp and other so-called ""meme"" stocks highlights shortcomings and challenges in the U.S. markets as retail investors become a bigger presence, exchange leaders said on Tuesday."|-8.415767207625713e-05|0.0
2021-03-16 14:59:00|Poland, Hungary win court fight over turnover taxes|Europe's top court ruled on Monday that Polish and Hungarian taxes on turnover targeted by the EU Commission for giving an unfair advantage to small businesses over their bigger, foreign rivals were legal.|-0.0020913232607678856|-4.0
2021-03-16 14:36:00|GameStop leads meme stocks lower, on track for sharp weekly drop|Shares of GameStop Corp slid further in early trade on Tuesday, continuing a slump that has seen the videogame retailer's stock shed a third of its value so far this week.|7.721210222100261e-05|0.0
2021-03-15 16:07:00|Walmart Canada to invest over C$500 million on store upgrades|Walmart Canada said on Monday it plans to invest more than C$500 million ($400.06 million) this year to refurbish its stores.|0.0005339098844059365|1.0
2021-03-15 14:39:00|Billionaire Ackman donates millions of Coupang shares to foundation, others|Billionaire hedge fund investor William Ackman said on Monday he donated 26.5 million shares in newly public South Korean e-commerce giant Coupang Inc to three entities, including his foundation.|-0.0013274077923818295|-3.0
2021-03-12 20:49:00|Amazon Canada asked to shut Brampton facility on COVID-19 concerns|Amazon.com Inc's Canada division has been ordered to close its Brampton facility in southern Ontario, with workers being asked to self-isolate for 14 days, according to a statement from Peel Public Health on Friday.|-0.00042306690965898675|-1.0
2021-03-12 15:50:00|Italy's Benetton group suspends all new orders from Myanmar|Italy's Benetton group on Friday said it had suspended all new orders from Myanmar with immediate effect due to rising violence after the ousting of Aung San Suu Kyi's government last month.|-0.0020524859598981537|-4.0
2021-03-11 18:40:00|Autogrill upbeat on long-term outlook after posting 2020 loss|Autogrill's chief executive said on Thursday he was upbeat about its long-term prospects although the Italian caterer booked a 480 million euro loss last year when the pandemic emptied bars and restaurants it runs in airports and motorways.|-6.540008501965122e-05|0.0
2021-03-11 15:50:00|China's antitrust regulators weigh levying record fine on Alibaba: WSJ|China's antitrust regulators are considering levying a record fine on Alibaba Group Holding Ltd over suspected anticompetitive behavior, the Wall Street Journal reported on Thursday, citing people familiar with the matter.|-0.00011792687173495242|0.0
2021-03-09 18:35:00|Jeff Bezos names Andrew Steer as head of Bezos Earth Fund|Amazon.com Inc's Jeff Bezos on Tuesday named Andrew Steer, who leads environmental think tank World Resources Institute, as the president and chief executive officer of his $10 billion Earth Fund.|0.0009438539557657943|2.0
2021-03-09 15:33:00|Retail investors' darling stock NanoRepro lures short sellers after 4,000% gain|Fertility testing company turned COVID-19 specialist NanoRepro <NN6G.DE>, which has been a recent darling of German retail investors, has seen a sudden emergence in short selling activity after a dramatic share price surge.|-0.0015853983741048738|-4.0
2021-03-09 14:39:00|Britain's M&S plans smaller store on flagship London site|British retailer Marks & Spencer has proposed a redevelopment of its flagship Marble Arch store in central London that would see the upper levels of the building made into office space, it said on Tuesday.|-0.0016669567138317687|-4.0
2021-03-08 15:02:00|Diageo buys hard seltzer brand Lone River Ranch Water|Johnnie Walker whisky maker Diageo said on Monday it has acquired Far West Spirits LLC, the parent company of Lone River Ranch Water, as it looks to expand in the fast-growing hard seltzer category.|-0.0014940439873435407|-4.0
2021-03-04 20:39:00|GameStop spikes as investors eye cryptic tweet by shareholder|Shares of Reddit-darling GameStop climbed on Thursday, rising more than 20% at one point in yet another unexplained move that left market watchers looking for a possible catalyst.|-0.0008328401073377512|-2.0
2021-03-02 19:20:00|Robinhood, a go-to for young traders, benefits from short sale demand|Robinhood, the online brokerage used by many retail traders to pile in to heavily shorted stocks like GameStop Corp, has made an ambitious push into loaning out its clients' shares to short sellers as it expands its business.|0.0005635707845195181|2.0
2021-03-02 15:18:00|Target to invest $4 billion annually to cement pandemic market share gains|Target Corp will invest $4 billion annually over the next several years to open more stores, upgrade existing ones and build-out its supply chain as the retailer tries to cement market share gains made during the COVID-19 pandemic.|0.00023095145400975348|1.0
2021-03-01 18:07:00|White House says Biden believes workers should have the right to organize|White House Press Secretary Jen Psaki said President Joe Biden believes workers should have the right to organize but he will not comment on specific cases that are before the National Labor Relations Board.|-0.0007562339029086873|-2.0
2021-02-26 20:24:00|U.S. SEC suspends trading in 15 securities due to 'questionable' social media activity|"The U.S. securities regulator on Friday suspended trading in the securities of 15 companies because of ""questionable trading and social media activity,"" the latest in a string of temporary trading halts amid volatile trading in so-called ""meme stocks."""|-0.0037389440091171178|-5.0
2021-02-26 18:38:00|Biden on track to apply Trump-era rule targeting Chinese tech supply chain concerns|The Biden administration plans to allow a Trump-era rule targeting Chinese technology firms deemed to pose a threat to the United States to go into effect despite objections from U.S. businesses, the U.S. Commerce Department said on Friday.|-0.0020168856060117646|-4.0
2021-02-25 18:57:00|"Robinhood says Munger criticism reflects 'elitist"" mindset"|"Robinhood, a retail brokerage popular with young investors, shot back on Thursday against criticism of the current ""meme"" stock frenzy by investor Warren Buffett's longtime partner Charlie Munger, who compared the action to betting on horse races."|0.0016174904635037901|4.0
2021-02-25 16:43:00|Shift to sun, ski and suburbs gives Airbnb advantage over hotels|Airbnb's quarterly results are likely to show the pandemic may have helped the home rental company lure leisure travelers away from big hotels during the global travel collapse of 2020.|-0.0032552690872537093|-5.0
2021-02-25 15:50:00|Short-sellers lost $818 million on Gamestop bets on Wednesday: Ortex|Short-sellers are estimated to have lost $818 million on Wednesday from their bearish bets on videogame maker Gamestop, data from financial analytics firm Ortex showed.|-0.0012287460148779905|-3.0
2021-02-24 16:23:00|U.S. retail sales in 2021 expected to jump on vaccine, stimulus in positive sign for economy - NRF|U.S. retail sales could rise as much as 8.2% to more than $4.33 trillion this year as more people get the COVID-19 vaccine and the economy reopens, the National Retail Federation (NRF) said on Wednesday.|0.000751775523459397|2.0
2021-02-23 15:42:00|SolarWinds, Microsoft, FireEye, CrowdStrike defend actions in major hack - U.S. Senate hearing|Top executives at Texas-based software company SolarWinds Corp, Microsoft Corp and cybersecurity firms FireEye Inc and CrowdStrike Holdings Inc defended their conduct in breaches blamed on Russian hackers and sought to shift responsibility elsewhere in testimony to a U.S...|0.005592893447362135|5.0
2021-02-22 18:14:00|Statistics Canada revises up two core measures of inflation for January|Two of three core measures of Canadian inflation watched closely by the Bank of Canada were revised upward on Monday, as Statistics Canada reversed methodological changes made ahead of its last release that made the January data appear weaker.|-0.0003927806909113096|-1.0
2021-02-19 17:09:00|Citadel's Griffin says firm does not use personal information of retail investors: CNBC|Market maker Citadel Securities does not use the personal information of retail investors, its billionaire co-founder Ken Griffin told CNBC on Friday, a day after the U.S. congressional hearing on GameStop.|-0.00029909548456330537|-1.0
2021-02-18 15:53:00|Mexico's Walmart unit eyes $1.08 billion capital investments in 2021|Walmart de Mexico, Mexico's largest retailer, said on Thursday that it plans to spend 22.2 billion pesos ($1.08 billion) on capital expenditure this year.|0.0019203324811545297|4.0
2021-02-17 20:54:00|Players in GameStop market drama make their case to lawmakers|Wall Street hedge fund managers, the chief executives of Robinhood and Reddit and a YouTube streamer known as Roaring Kitty on Wednesday defended their roles in GameStop's Reddit-fueled stock rally before they face a grilling by lawmakers.|-0.0003906148277588173|-1.0
2021-02-11 17:24:00|L'Oreal sees post-pandemic 'roaring 20s' driving cosmetics rebound|"L'Oreal, the world's biggest cosmetics group, forecast a strong rebound in makeup sales when the COVID-19 pandemic gives way to a ""roaring 20s"" when people get dressed up and go out again to socialise."|-0.002116353607327759|-4.0
2021-02-11 15:39:00|U.S. markets regulator suspends trading in defunct 'meme stock'|The U.S. Securities and Exchange Commission (SEC) on Thursday suspended trading in inactive Minnesota corporation SpectraScience Inc., among the latest securities to see a surge in interest from retail investors on social media.|0.0015183346467861902|4.0
2021-02-10 19:41:00|Volkswagen Mexico to adjust Jetta output until March 5 over semiconductors|Volkswagen AG's Mexico unit said in a statement on Wednesday it would adjust the production schedule of its Jetta model until March 5 due to a global shortage of semiconductors.|0.0006919465780155232|2.0
2021-02-10 18:58:00|Mexican same-store retail sales fell 8.2% in January: ANTAD|Mexican retailers' association ANTAD said on Wednesday that same-store sales fell by 8.2% in January compared with the same month last year.|0.00018329048211884746|0.0
2021-02-10 16:08:00|Robinhood, Melvin Capital, Citadel executives expected to testify in Congress on GameStop turmoil: sources|Executives from Robinhood, Melvin Capital and Citadel Securities are expected to testify before a House panel at a Feb. 18 hearing exploring trading turmoil in GameStop Corp and related stocks, said two sources familiar with the matter.|0.00011792300887725204|0.0
2021-02-10 16:06:00|EU privacy agency urges more safeguards to curb U.S. tech giants|EU privacy watchdog EDPS on Wednesday backed the bloc's push to curb the power of Apple, Amazon, Alphabet unit Google and Facebook via new tough rules and suggested more safeguards to boost users' privacy rights.|-0.0011722407623363518|-3.0
2021-02-10 15:53:00|COVID, climate, tax feature at first post-Trump G7 talks|"The new administration of U.S. President Joe Biden joins international talks on the global economy this week with other rich nations expecting a decisive break from the ""America First"" nationalism of Donald Trump."|0.004646380765720881|5.0
2021-02-04 20:46:00|Koss family rakes it in from Reddit-fueled rally|The family behind Koss Corp and some of the company's top executives raked in about $45 million from a surge in the headphone maker's stock price during a retail trading blitz that rocked Wall Street last week.|0.000988706266444428|3.0
2021-02-04 19:07:00|Euro zone retail sales rebound more than expected in December|Euro zone retail sales rebounded more than expected in December as Christmas shopping for clothes and shoes caused a surge in sales compared to November, with France and Belgium recording double digit monthly jumps, data showed on Thursday.|-0.0001856282812738863|-1.0
2021-02-03 20:12:00|SEC studies social media posts for signs of fraud in GameStop frenzy: Bloomberg|The U.S. securities regulator is reviewing social media posts for signs of potential fraud in frenzied trading of GameStop Corp's and other companies' shares, Bloomberg News reported on Wednesday, citing people familiar with the matter.|-0.0015367962475847374|-4.0
2021-02-03 16:54:00|Retail trading fever drives U.S. equity option volumes to record monthly high|Trading volumes in U.S. equity options surged 70% to hit a record monthly high in January, data from Options Clearing Corporation showed, as a retail share trading boom drove extreme gains in some small-cap stocks such as GameStop.|0.0017080558069333396|4.0
2021-02-02 16:39:00|Robinhood raises trading limit on five companies|Online trading platform Robinhood said on Tuesday it had raised trading limits on stocks of five companies, including GameStop Corp and AMC Entertainment Holdings Inc.|0.0015790946261946548|4.0
2021-02-02 15:24:00|Amazon scores Indian win as court freezes Future's $3.4 billion retail deal|An Indian court blocked Future Group's sale of a swathe of assets to rival Reliance Industries on Tuesday after Amazon raised objections to the $3.4 billion deal, in a battle of the retail titans that could reshape the shopping sector.|-0.00044026421080134437|-1.0
2021-02-01 19:46:00|Exclusive: Robinhood explores raising more debt to fulfill Reddit-fueled order frenzy - sources|Robinhood, the U.S. online broker that has emerged as a gateway for amateur traders challenging Wall Street hedge funds, has held talks with banks about raising $1 billion in debt so it can continue to fulfill orders for heavily shorted stocks, according to people familiar...|0.0006130163811599587|2.0
2021-02-01 15:29:00|Europe's 'long the short' trade cools down|European shares caught up in last week's squeeze on hedge funds' short positions have mostly fallen back from their highs, in a sign local retail investors lack the clout of their counterparts in the United States.|0.0019877159983696657|4.0
2021-02-01 15:16:00|Tesla set for at least 1 billion euros in German subsidies - Business Insider|U.S. electric vehicle maker Tesla stands to receive at least 1 billion euros ($1.2 billion) in public funding from Germany for setting up a battery cell factory near Berlin, Business Insider reported on Monday.|0.00037162193508133434|1.0
2021-01-29 15:43:00|Exclusive: U.S. lobby group urges India not to tighten foreign e-commerce rules|A U.S. lobby group which represents firms including Amazon.com and Walmart has urged India not to tighten foreign investment rules for e-commerce companies again, according to a letter seen by Reuters.|-0.0014702865349108807|-4.0
2021-01-27 19:56:00|Explainer: How retail traders squeezed Wall Street for bets against GameStop|A surge of retail stock trading over the last year lit the fuse that sent shares of GameStop Corp rocketing higher without a clear business reason, market watchers say, squeezing hedge funds that had bet against the video game retailer and other companies that were out of...|-0.0024344789028520886|-5.0
2021-01-27 18:41:00|White House monitoring situation involving GameStop, other firms|The White House and Treasury Department are monitoring the situation involving GameStop and other companies that have seen sharp gains on the stock market, White House Press Secretary Jen Psaki said on Wednesday.|-0.0005779246386117265|-2.0
2021-01-22 16:48:00|EU lawmakers want Amazon, Apple, Facebook, Google CEOs at Feb. 1 hearing|EU lawmakers have invited the chief executives of Amazon, Apple, Facebook and Alphabet to a Feb. 1 hearing in Brussels as they try to crack down on the powers of U.S. tech giants.|0.0009278852369789536|2.0
2021-01-22 15:15:00|Alphabet's Pichai to hold video call with EU antitrust chief Jan. 25|Alphabet Chief Executive Sundar Pichai will hold a video-conference call with EU antitrust chief Margrethe Vestager on Jan. 25, according to a European Commission schedule published on Friday.|-0.001120530279842158|-3.0
2021-01-15 14:36:00|Amazon Web Services opens first office in Greece|Amazon Inc's cloud computing division opened its first office in Greece on Friday to support what it said was a growing number of companies and public sector agencies using its cloud services.|0.0017971232629780953|4.0
